{
  "schema_version": "0.2.0",
  "meeting_id": "01HXR5K7P8Q3M2N4VWXYZABCDE",
  "generated_at": "2026-05-07T14:30:00Z",
  "source": {
    "file_name": "standup.m4a",
    "sha256": "e3b0c44298fc1c149afbf4c8996fb92427ae41e4649b934ca495991b7852b855",
    "format": "mp4,m4a"
  },
  "transcript": {
    "language": "en",
    "text": "Welcome everyone. Let us start the standup.",
    "segments": [
      {
        "id": "seg_0001",
        "start_sec": 0.0,
        "end_sec": 2.4,
        "text": "Welcome everyone."
      },
      {
        "id": "seg_0002",
        "start_sec": 2.4,
        "end_sec": 5.1,
        "text": "Let us start the standup."
      }
    ]
  },
  "provenance": {
    "producer": {
      "name": "samuraizer",
      "version": "0.2.0"
    },
    "pipeline": {
      "transcription": {
        "engine": "whisper.cpp"
      }
    }
  }
}
